{
  "schema": "muxui-derived-api-v1",
  "generatedFrom": "packages/react/src/fields.ts",
  "component": "muxui:component:autocomplete",
  "binding": "web.react",
  "export": "Autocomplete",
  "api": {
    "props": [
      "label",
      "description",
      "errorMessage",
      "value",
      "defaultValue",
      "disabled",
      "size",
      "readOnly",
      "required",
      "invalid",
      "name",
      "items",
      "placeholder"
    ],
    "events": [
      "change",
      "select"
    ],
    "defaults": {
      "defaultValue": "",
      "disabled": false,
      "size": "md",
      "readOnly": false,
      "required": false,
      "invalid": false
    },
    "propDetails": {
      "label": {
        "type": {
          "kind": "host",
          "name": "Exclude",
          "typeArguments": [
            {
              "kind": "host",
              "name": "React.ReactNode"
            },
            {
              "kind": "union",
              "members": [
                {
                  "kind": "null"
                },
                {
                  "kind": "undefined"
                },
                {
                  "kind": "boolean"
                }
              ]
            }
          ]
        },
        "required": false,
        "description": "The visible label, which also names the field. Without one, the field needs an aria-label or aria-labelledby, and an empty label does not count."
      },
      "description": {
        "type": {
          "kind": "host",
          "name": "React.ReactNode"
        },
        "required": false,
        "description": "Supporting text shown with the field, which also describes it."
      },
      "errorMessage": {
        "type": {
          "kind": "host",
          "name": "React.ReactNode"
        },
        "required": false,
        "description": "The message the field shows, in place of the built-in one, only while it is invalid, through the invalid prop or failed native, custom, or server validation. It never makes the field invalid by itself."
      },
      "value": {
        "type": {
          "kind": "string"
        },
        "required": false,
        "description": "The submitted value, when the caller controls it. The input shows a matching item's label."
      },
      "defaultValue": {
        "type": {
          "kind": "string"
        },
        "required": false,
        "description": "The starting value, when the field controls itself."
      },
      "disabled": {
        "type": {
          "kind": "boolean"
        },
        "required": false,
        "description": "Disables the field: it can be neither focused nor changed."
      },
      "size": {
        "type": {
          "kind": "union",
          "members": [
            {
              "kind": "literal",
              "value": "sm"
            },
            {
              "kind": "literal",
              "value": "md"
            },
            {
              "kind": "literal",
              "value": "lg"
            }
          ]
        },
        "required": false,
        "enum": [
          "sm",
          "md",
          "lg"
        ],
        "description": "The control size. The suggestion list takes it too."
      },
      "readOnly": {
        "type": {
          "kind": "boolean"
        },
        "required": false,
        "description": "Makes the field read-only: its text stays visible and focusable but cannot be changed, and no suggestion can be chosen."
      },
      "required": {
        "type": {
          "kind": "boolean"
        },
        "required": false,
        "description": "Marks the field required, so a form with native validation does not submit while it is empty."
      },
      "invalid": {
        "type": {
          "kind": "boolean"
        },
        "required": false,
        "description": "Marks the field invalid and shows its error message. Left false, validation decides, so failed native, custom, or server validation can still make the field invalid."
      },
      "name": {
        "type": {
          "kind": "string"
        },
        "required": false,
        "description": "The form field name. A named field submits the chosen suggestion's value, or the typed text when nothing was chosen."
      },
      "items": {
        "type": {
          "kind": "array",
          "element": {
            "kind": "union",
            "members": [
              {
                "kind": "reference",
                "name": "AutocompleteItem"
              },
              {
                "kind": "string"
              }
            ]
          },
          "readonly": false
        },
        "required": false,
        "description": "The suggestions, as strings or records. A string is shown and submitted as its text. Typing filters them by their text."
      },
      "placeholder": {
        "type": {
          "kind": "string"
        },
        "required": false,
        "description": "An example value shown while the field is empty. It does not name the field."
      }
    },
    "eventDetails": {
      "change": {
        "prop": "onChange",
        "type": {
          "kind": "function",
          "parameters": [
            {
              "name": "value",
              "type": {
                "kind": "string"
              },
              "required": true
            }
          ],
          "returns": {
            "kind": "void"
          }
        },
        "required": false,
        "description": "Called with the new value each time the text changes or a suggestion is chosen. A chosen suggestion reports its value, not its label."
      },
      "select": {
        "prop": "onSelect",
        "type": {
          "kind": "function",
          "parameters": [
            {
              "name": "item",
              "type": {
                "kind": "reference",
                "name": "AutocompleteSelectionItem"
              },
              "required": false
            }
          ],
          "returns": {
            "kind": "void"
          }
        },
        "required": false,
        "description": "Called when a suggestion is chosen, with the chosen item."
      }
    },
    "types": {
      "AutocompleteItem": {
        "type": {
          "kind": "object",
          "members": [
            {
              "name": "id",
              "type": {
                "kind": "string"
              },
              "required": false,
              "readonly": false,
              "description": "Identifies the suggestion. Without one, a record takes its value, or else its position, as one."
            },
            {
              "name": "label",
              "type": {
                "kind": "host",
                "name": "React.ReactNode"
              },
              "required": false,
              "readonly": false,
              "description": "What the list and the input show. Without one, a record shows its value, or else its id."
            },
            {
              "name": "value",
              "type": {
                "kind": "string"
              },
              "required": false,
              "readonly": false,
              "description": "What the form and onChange receive when the suggestion is chosen. Without one, a record submits its id, or, with no id either, its label's text."
            },
            {
              "name": "disabled",
              "type": {
                "kind": "boolean"
              },
              "required": false,
              "readonly": false,
              "description": "Skips the suggestion in selection."
            }
          ]
        },
        "description": "One suggestion."
      },
      "AutocompleteSelectionItem": {
        "type": {
          "kind": "object",
          "members": [
            {
              "name": "id",
              "type": {
                "kind": "string"
              },
              "required": true,
              "readonly": false
            },
            {
              "name": "label",
              "type": {
                "kind": "host",
                "name": "React.ReactNode"
              },
              "required": true,
              "readonly": false
            },
            {
              "name": "value",
              "type": {
                "kind": "string"
              },
              "required": true,
              "readonly": false
            }
          ]
        },
        "description": "The suggestion onSelect receives, with each field filled in."
      }
    }
  }
}
