{
  "schema": "muxui-derived-api-v1",
  "generatedFrom": "packages/react/src/fields.ts",
  "component": "muxui:component:switch",
  "binding": "web.react",
  "export": "Switch",
  "api": {
    "props": [
      "label",
      "description",
      "errorMessage",
      "selected",
      "defaultSelected",
      "disabled",
      "size",
      "readOnly",
      "required",
      "invalid",
      "name",
      "value"
    ],
    "events": [
      "change"
    ],
    "defaults": {
      "defaultSelected": false,
      "disabled": false,
      "size": "md",
      "readOnly": false,
      "required": false,
      "invalid": false
    },
    "propDetails": {
      "label": {
        "type": {
          "kind": "host",
          "name": "Exclude",
          "typeArguments": [
            {
              "kind": "host",
              "name": "React.ReactNode"
            },
            {
              "kind": "union",
              "members": [
                {
                  "kind": "null"
                },
                {
                  "kind": "undefined"
                },
                {
                  "kind": "boolean"
                }
              ]
            }
          ]
        },
        "required": false,
        "description": "The visible label, which also names the Switch. Without one, the Switch needs an aria-label or aria-labelledby, and children do not count as a name. When both label and children are given, label is shown."
      },
      "description": {
        "type": {
          "kind": "host",
          "name": "React.ReactNode"
        },
        "required": false,
        "description": "Supporting text shown with the Switch, which also describes it."
      },
      "errorMessage": {
        "type": {
          "kind": "host",
          "name": "React.ReactNode"
        },
        "required": false,
        "description": "The message the Switch shows, in place of the built-in one, only while it is invalid, through the invalid prop or failed native, custom, or server validation. It never makes the Switch invalid by itself."
      },
      "selected": {
        "type": {
          "kind": "boolean"
        },
        "required": false,
        "description": "Whether the Switch is on, when the caller controls it."
      },
      "defaultSelected": {
        "type": {
          "kind": "boolean"
        },
        "required": false,
        "description": "Whether the Switch starts on, when it controls itself."
      },
      "disabled": {
        "type": {
          "kind": "boolean"
        },
        "required": false,
        "description": "Disables the Switch: it can be neither focused nor changed."
      },
      "size": {
        "type": {
          "kind": "reference",
          "name": "ControlSize"
        },
        "required": false,
        "enum": [
          "sm",
          "md",
          "lg"
        ],
        "description": "The control size."
      },
      "readOnly": {
        "type": {
          "kind": "boolean"
        },
        "required": false,
        "description": "Makes the Switch read-only: its state stays visible and focusable but cannot be changed."
      },
      "required": {
        "type": {
          "kind": "boolean"
        },
        "required": false,
        "description": "Marks the Switch required, so a form with native validation does not submit while it is off."
      },
      "invalid": {
        "type": {
          "kind": "boolean"
        },
        "required": false,
        "description": "Marks the Switch invalid and shows its error message. Left false, validation decides, so failed native, custom, or server validation can still make the Switch invalid."
      },
      "name": {
        "type": {
          "kind": "string"
        },
        "required": false,
        "description": "The form field name. A named Switch submits its value while it is on."
      },
      "value": {
        "type": {
          "kind": "string"
        },
        "required": false,
        "description": "What a named Switch submits while it is on."
      }
    },
    "eventDetails": {
      "change": {
        "prop": "onChange",
        "type": {
          "kind": "function",
          "parameters": [
            {
              "name": "selected",
              "type": {
                "kind": "boolean"
              },
              "required": true
            }
          ],
          "returns": {
            "kind": "void"
          }
        },
        "required": false,
        "description": "Called with the new on or off state each time it changes."
      }
    },
    "types": {
      "ControlSize": {
        "type": {
          "kind": "union",
          "members": [
            {
              "kind": "literal",
              "value": "sm"
            },
            {
              "kind": "literal",
              "value": "md"
            },
            {
              "kind": "literal",
              "value": "lg"
            }
          ]
        },
        "description": "The shared control sizes."
      }
    }
  }
}
